Microsoft Windows [Version 10.0.17134.765]
(c) 2018 Microsoft Corporation. All rights reserved.
C:\>mysql -hlocalhost -u root
Welcome to the MariaDB monitor.  Commands end with ; or \g.
Your MariaDB connection id is 10
Server version: 10.3.16-MariaDB mariadb.org binary distribution

Copyright (c) 2000, 2018, Oracle, MariaDB Corporation Ab and others.

Type 'help;' or '\h' for help. Type '\c' to clear the current input statement.

MariaDB [(none)]> show databases;
+--------------------+
| Database           |
+--------------------+
| information_schema |
| mysql              |
| performance_schema |
| phpmyadmin         |
| test               |
| yourname           |
+--------------------+
6 rows in set (0.001 sec)

MariaDB [(none)]> create database YUKTHI;
Query OK, 1 row affected (0.045 sec)

MariaDB [(none)]> show databases;
+--------------------+
| Database           |
+--------------------+
| information_schema |
| mysql              |
| performance_schema |
| phpmyadmin         |
| test               |
| yourname           |
| yukthi             |
+--------------------+
7 rows in set (0.001 sec)

MariaDB [(none)]> use yukthi;
Database changed
MariaDB [yukthi]> create table student(USN varchar(10),NAME varchar(20),SEM integer,SEC char(1));
Query OK, 0 rows affected (0.449 sec)

MariaDB [yukthi]> desc student;
+-------+-------------+------+-----+---------+-------+
| Field | Type        | Null | Key | Default | Extra |
+-------+-------------+------+-----+---------+-------+
| USN   | varchar(10) | YES  |     | NULL    |       |
| NAME  | varchar(20) | YES  |     | NULL    |       |
| SEM   | int(11)     | YES  |     | NULL    |       |
| SEC   | char(1)     | YES  |     | NULL    |       |
+-------+-------------+------+-----+---------+-------+
4 rows in set (0.110 sec)

MariaDB [yukthi]> insert into student values('4MH16CS010','ARNAV',5,'C');
Query OK, 1 row affected (0.178 sec)

MariaDB [yukthi]> insert into student values('4MH16CS050','KIYARA',5,'C');
Query OK, 1 row affected (0.084 sec)

MariaDB [yukthi]> insert into student values('4MH16CS065','RAKSHA',5,'B');
Query OK, 1 row affected (0.086 sec)

MariaDB [yukthi]> insert into student values('4MH16CS003','ABHI',5,'B');
Query OK, 1 row affected (0.078 sec)

MariaDB [yukthi]> insert into student values('4MH16CS116','YASH',5,'A');
Query OK, 1 row affected (0.087 sec)

MariaDB [yukthi]> select * from student;
+------------+--------+------+------+
| USN        | NAME   | SEM  | SEC  |
+------------+--------+------+------+
| 4MH16CS010 | ARNAV  |    5 | C    |
| 4MH16CS050 | KIYARA |    5 | C    |
| 4MH16CS065 | RAKSHA |    5 | B    |
| 4MH16CS003 | ABHI   |    5 | B    |
| 4MH16CS116 | YASH   |    5 | A    |
+------------+--------+------+------+
5 rows in set (0.044 sec)

MariaDB [yukthi]> select USN,NAME from student;
+------------+--------+
| USN        | NAME   |
+------------+--------+
| 4MH16CS010 | ARNAV  |
| 4MH16CS050 | KIYARA |
| 4MH16CS065 | RAKSHA |
| 4MH16CS003 | ABHI   |
| 4MH16CS116 | YASH   |
+------------+--------+
5 rows in set (0.026 sec)

MariaDB [yukthi]> select NAME from student;
+--------+
| NAME   |
+--------+
| ARNAV  |
| KIYARA |
| RAKSHA |
| ABHI   |
| YASH   |
+--------+
5 rows in set (0.001 sec)

MariaDB [yukthi]> select * from student where SEC='C';
+------------+--------+------+------+
| USN        | NAME   | SEM  | SEC  |
+------------+--------+------+------+
| 4MH16CS010 | ARNAV  |    5 | C    |
| 4MH16CS050 | KIYARA |    5 | C    |
+------------+--------+------+------+
2 rows in set (0.077 sec)

MariaDB [yukthi]> select * from student where SEC='C' or SEC='A';
+------------+--------+------+------+
| USN        | NAME   | SEM  | SEC  |
+------------+--------+------+------+
| 4MH16CS010 | ARNAV  |    5 | C    |
| 4MH16CS050 | KIYARA |    5 | C    |
| 4MH16CS116 | YASH   |    5 | A    |
+------------+--------+------+------+
3 rows in set (0.035 sec)

MariaDB [yukthi]> select * from student where SEC!='C';
+------------+--------+------+------+
| USN        | NAME   | SEM  | SEC  |
+------------+--------+------+------+
| 4MH16CS065 | RAKSHA |    5 | B    |
| 4MH16CS003 | ABHI   |    5 | B    |
| 4MH16CS116 | YASH   |    5 | A    |
+------------+--------+------+------+
3 rows in set (0.033 sec)

MariaDB [yukthi]> select count(*) from student;
+----------+
| count(*) |
+----------+
|        5 |
+----------+
1 row in set (0.022 sec)

MariaDB [yukthi]> select count(*) from student where SEC='A';
+----------+
| count(*) |
+----------+
|        1 |
+----------+
1 row in set (0.001 sec)

MariaDB [yukthi]> select NAME,USN from student where SEC='A';
+------+------------+
| NAME | USN        |
+------+------------+
| YASH | 4MH16CS116 |
+------+------------+
1 row in set (0.001 sec)

MariaDB [yukthi]> update student
    -> set NAME='ARNAV R'
    -> where USN='4MH16CS010';
Query OK, 1 row affected (0.134 sec)
Rows matched: 1  Changed: 1  Warnings: 0

MariaDB [yukthi]> select * from student;
+------------+---------+------+------+
| USN        | NAME    | SEM  | SEC  |
+------------+---------+------+------+
| 4MH16CS010 | ARNAV R |    5 | C    |
| 4MH16CS050 | KIYARA  |    5 | C    |
| 4MH16CS065 | RAKSHA  |    5 | B    |
| 4MH16CS003 | ABHI    |    5 | B    |
| 4MH16CS116 | YASH    |    5 | A    |
+------------+---------+------+------+
5 rows in set (0.001 sec)

MariaDB [yukthi]> alter table student change SEC SECTION char(5);
Query OK, 5 rows affected (1.237 sec)
Records: 5  Duplicates: 0  Warnings: 0

MariaDB [yukthi]> alter table student change SEM SEMESTER integer;
Query OK, 0 rows affected (0.106 sec)
Records: 0  Duplicates: 0  Warnings: 0

MariaDB [yukthi]> select * from student;
+------------+---------+----------+---------+
| USN        | NAME    | SEMESTER | SECTION |
+------------+---------+----------+---------+
| 4MH16CS010 | ARNAV R |        5 | C       |
| 4MH16CS050 | KIYARA  |        5 | C       |
| 4MH16CS065 | RAKSHA  |        5 | B       |
| 4MH16CS003 | ABHI    |        5 | B       |
| 4MH16CS116 | YASH    |        5 | A       |
+------------+---------+----------+---------+
5 rows in set (0.002 sec)

MariaDB [yukthi]> alter table student add FEE float;
Query OK, 0 rows affected (0.170 sec)
Records: 0  Duplicates: 0  Warnings: 0

MariaDB [yukthi]> select * from student;
+------------+---------+----------+---------+------+
| USN        | NAME    | SEMESTER | SECTION | FEE  |
+------------+---------+----------+---------+------+
| 4MH16CS010 | ARNAV R |        5 | C       | NULL |
| 4MH16CS050 | KIYARA  |        5 | C       | NULL |
| 4MH16CS065 | RAKSHA  |        5 | B       | NULL |
| 4MH16CS003 | ABHI    |        5 | B       | NULL |
| 4MH16CS116 | YASH    |        5 | A       | NULL |
+------------+---------+----------+---------+------+
5 rows in set (0.001 sec)

MariaDB [yukthi]> update student
    -> set FEE=50500;
Query OK, 5 rows affected (0.085 sec)
Rows matched: 5  Changed: 5  Warnings: 0

MariaDB [yukthi]> select * from student;
+------------+---------+----------+---------+-------+
| USN        | NAME    | SEMESTER | SECTION | FEE   |
+------------+---------+----------+---------+-------+
| 4MH16CS010 | ARNAV R |        5 | C       | 50500 |
| 4MH16CS050 | KIYARA  |        5 | C       | 50500 |
| 4MH16CS065 | RAKSHA  |        5 | B       | 50500 |
| 4MH16CS003 | ABHI    |        5 | B       | 50500 |
| 4MH16CS116 | YASH    |        5 | A       | 50500 |
+------------+---------+----------+---------+-------+
5 rows in set (0.028 sec)

MariaDB [yukthi]> update student
    -> set FEE=35000
    -> where USN='4MH16CS050';
Query OK, 1 row affected (0.072 sec)
Rows matched: 1  Changed: 1  Warnings: 0

MariaDB [yukthi]> update student
    -> set FEE=44000
    -> where USN='4MH16CS065';
Query OK, 1 row affected (0.056 sec)
Rows matched: 1  Changed: 1  Warnings: 0

MariaDB [yukthi]> update student
    -> set FEE=25000
    -> where USN='4MH16CS003';
Query OK, 1 row affected (0.078 sec)
Rows matched: 1  Changed: 1  Warnings: 0

MariaDB [yukthi]> update student
    -> set FEE=33000
    -> where USN='4MH16CS116';
Query OK, 1 row affected (0.063 sec)
Rows matched: 1  Changed: 1  Warnings: 0

MariaDB [yukthi]> select * from student;
+------------+---------+----------+---------+-------+
| USN        | NAME    | SEMESTER | SECTION | FEE   |
+------------+---------+----------+---------+-------+
| 4MH16CS010 | ARNAV R |        5 | C       | 50500 |
| 4MH16CS050 | KIYARA  |        5 | C       | 35000 |
| 4MH16CS065 | RAKSHA  |        5 | B       | 44000 |
| 4MH16CS003 | ABHI    |        5 | B       | 25000 |
| 4MH16CS116 | YASH    |        5 | A       | 33000 |
+------------+---------+----------+---------+-------+
5 rows in set (0.001 sec)

MariaDB [yukthi]> select sum(fee) from student;
+----------+
| sum(fee) |
+----------+
|   187500 |
+----------+
1 row in set (0.045 sec)

MariaDB [yukthi]> select max(fee) from student;
+----------+
| max(fee) |
+----------+
|    50500 |
+----------+
1 row in set (0.034 sec)

MariaDB [yukthi]> select min(fee) from student;
+----------+
| min(fee) |
+----------+
|    25000 |
+----------+
1 row in set (0.001 sec)

MariaDB [yukthi]> select avg(fee) from student;
+----------+
| avg(fee) |
+----------+
|    37500 |
+----------+
1 row in set (0.001 sec)

MariaDB [yukthi]> select sum(fee),max(fee),min(fee),avg(fee) from student;
+----------+----------+----------+----------+
| sum(fee) | max(fee) | min(fee) | avg(fee) |
+----------+----------+----------+----------+
|   187500 |    50500 |    25000 |    37500 |
+----------+----------+----------+----------+
1 row in set (0.001 sec)

MariaDB [yukthi]> select sum(fee) as sum_of_fee from student;
+------------+
| sum_of_fee |
+------------+
|     187500 |
+------------+
1 row in set (0.036 sec)

MariaDB [yukthi]> alter table student drop FEE;
Query OK, 0 rows affected (0.979 sec)
Records: 0  Duplicates: 0  Warnings: 0

MariaDB [yukthi]> select * from student;
+------------+---------+----------+---------+
| USN        | NAME    | SEMESTER | SECTION |
+------------+---------+----------+---------+
| 4MH16CS010 | ARNAV R |        5 | C       |
| 4MH16CS050 | KIYARA  |        5 | C       |
| 4MH16CS065 | RAKSHA  |        5 | B       |
| 4MH16CS003 | ABHI    |        5 | B       |
| 4MH16CS116 | YASH    |        5 | A       |
+------------+---------+----------+---------+
5 rows in set (0.001 sec)

MariaDB [yukthi]> delete from student where NAME='KIYARA';
Query OK, 1 row affected (0.116 sec)

MariaDB [yukthi]> select * from student;
+------------+---------+----------+---------+
| USN        | NAME    | SEMESTER | SECTION |
+------------+---------+----------+---------+
| 4MH16CS010 | ARNAV R |        5 | C       |
| 4MH16CS065 | RAKSHA  |        5 | B       |
| 4MH16CS003 | ABHI    |        5 | B       |
| 4MH16CS116 | YASH    |        5 | A       |
+------------+---------+----------+---------+
4 rows in set (0.001 sec)

MariaDB [yukthi]> delete from student
    -> ;
Query OK, 4 rows affected (0.125 sec)

MariaDB [yukthi]> show tables;
+------------------+
| Tables_in_yukthi |
+------------------+
| student          |
+------------------+
1 row in set (0.032 sec)

MariaDB [yukthi]> select * from student;
Empty set (0.001 sec)

MariaDB [yukthi]> drop table student;
Query OK, 0 rows affected (0.269 sec)

MariaDB [yukthi]> show tables;
Empty set (0.001 sec)

MariaDB [yukthi]> drop database yukthi;
Query OK, 0 rows affected (0.003 sec)

MariaDB [(none)]> show databases;
+--------------------+
| Database           |
+--------------------+
| information_schema |
| mysql              |
| performance_schema |
| phpmyadmin         |
| test               |
| yourname           |
+--------------------+
6 rows in set (0.003 sec)

MariaDB [(none)]> exit;
Bye

C:\>